{
  "schemaVersion": 1,
  "localizationVersion": "vertical-slice.7",
  "locale": "zh-Hans",
  "status": "approved",
  "owner": "localization",
  "source": "original",
  "entries": [
    { "key": "loc.card.strike.name", "value": "打击" },
    { "key": "loc.card.strike.description", "value": "造成 8 点伤害。" },
    { "key": "loc.card.defend.name", "value": "防御" },
    { "key": "loc.card.defend.description", "value": "获得 6 点格挡。" },
    { "key": "loc.card.insight.name", "value": "洞察" },
    { "key": "loc.card.insight.description", "value": "抽 1 张牌。消耗。" },
    { "key": "loc.card.heavy_strike.name", "value": "重击" },
    { "key": "loc.card.heavy_strike.description", "value": "造成 14 点伤害。" },
    { "key": "loc.card.quick_guard.name", "value": "迅捷守势" },
    { "key": "loc.card.quick_guard.description", "value": "获得 4 点格挡。抽 1 张牌。" },
    { "key": "loc.card.strike_plus.name", "value": "打击+" },
    { "key": "loc.card.strike_plus.description", "value": "造成 11 点伤害。" },
    { "key": "loc.card.defend_plus.name", "value": "防御+" },
    { "key": "loc.card.defend_plus.description", "value": "获得 9 点格挡。" },
    { "key": "loc.card.insight_plus.name", "value": "洞察+" },
    { "key": "loc.card.insight_plus.description", "value": "抽 2 张牌。消耗。" },
    { "key": "loc.card.expose.name", "value": "揭破" },
    { "key": "loc.card.expose.description", "value": "造成 4 点伤害，施加 2 层易伤。" },
    { "key": "loc.card.focus.name", "value": "凝神" },
    { "key": "loc.card.focus.description", "value": "获得 4 点格挡和 1 层力量。" },
    { "key": "loc.card.dampen.name", "value": "压制" },
    { "key": "loc.card.dampen.description", "value": "施加 2 层虚弱。" },
    { "key": "loc.status.strength.name", "value": "力量" },
    { "key": "loc.status.strength.description", "value": "每层使伤害增加 1 点。" },
    { "key": "loc.status.weak.name", "value": "虚弱" },
    { "key": "loc.status.weak.description", "value": "造成的伤害降低 25%。" },
    { "key": "loc.status.vulnerable.name", "value": "易伤" },
    { "key": "loc.status.vulnerable.description", "value": "受到的伤害增加 50%。" },
    { "key": "loc.relic.ember_quill.name", "value": "余烬羽笔" },
    { "key": "loc.relic.ember_quill.description", "value": "战斗开始时，获得 2 点格挡和 1 层力量。" },
    { "key": "loc.shop.ink_market.name", "value": "墨市" },
    { "key": "loc.shop.ink_market.description", "value": "用金币购买卡牌，或从牌组中移除一张牌。" },
    { "key": "loc.enemy.ink_wisp.name", "value": "墨影灵" },
    { "key": "loc.enemy.ink_wisp.description", "value": "饥饿的念头凝成了形体。" },
    { "key": "loc.enemy.bronze_sentry.name", "value": "青铜哨卫" },
    { "key": "loc.enemy.bronze_sentry.description", "value": "不知疲倦地守卫下层档案馆。" },
    { "key": "loc.enemy.archive_warden.name", "value": "档案守望者" },
    { "key": "loc.enemy.archive_warden.description", "value": "无情抹去每一个禁忌结局的守门人。" },
    { "key": "loc.encounter.first_wisp.name", "value": "初遇墨灵" },
    { "key": "loc.encounter.first_wisp.description", "value": "在岔路口面对墨影灵。" },
    { "key": "loc.encounter.bronze_sentry.name", "value": "哨卫长廊" },
    { "key": "loc.encounter.bronze_sentry.description", "value": "突破青铜守卫。" },
    { "key": "loc.encounter.archive_warden.name", "value": "终末索引" },
    { "key": "loc.encounter.archive_warden.description", "value": "击败档案守望者。" },
    { "key": "loc.route.prologue.name", "value": "岔路" },
    { "key": "loc.route.prologue.description", "value": "决定这一章如何开始。" },
    { "key": "loc.route.wisp.name", "value": "墨迹小径" },
    { "key": "loc.route.wisp.description", "value": "脆弱却难以预测的敌人。" },
    { "key": "loc.route.sentry.name", "value": "青铜长廊" },
    { "key": "loc.route.sentry.description", "value": "更强的守卫封住了直路。" },
    { "key": "loc.route.interlude.name", "value": "寂静书架" },
    { "key": "loc.route.interlude.description", "value": "在封印档案馆前稍作喘息。" },
    { "key": "loc.route.rest.name", "value": "抄写者之火" },
    { "key": "loc.route.rest.description", "value": "在最终战前升级一张牌。" },
    { "key": "loc.route.shop.name", "value": "墨市" },
    { "key": "loc.route.shop.description", "value": "在面对守望者前花掉金币。" },
    { "key": "loc.route.warden.name", "value": "档案守望者" },
    { "key": "loc.route.warden.description", "value": "Boss——门后便是本章终点。" },
    { "key": "loc.speaker.guide", "value": "引路人" },
    { "key": "loc.speaker.narrator", "value": "旁白" },
    { "key": "loc.story.crossroads", "value": "一团苍白的墨影挡住去路。引路人静候你的回答。" },
    { "key": "loc.story.wisp_battle", "value": "你踏前一步，墨色聚成利爪。" },
    { "key": "loc.story.peaceful_end", "value": "你把墨影留在身后。有些故事在第一道伤口出现前就已结束。" },
    { "key": "loc.story.interlude", "value": "两条路在锁死的索引前汇合。守望者已经很近。" },
    { "key": "loc.story.warden_gate", "value": "你用最后一刻宁静，为开启封印之门做好准备。" },
    { "key": "loc.choice.face_wisp", "value": "迎战墨影灵" },
    { "key": "loc.choice.walk_away", "value": "转身离开" },
    { "key": "loc.choice.enter_archive", "value": "开启封印档案馆" },
    { "key": "ui.vertical_slice.title", "value": "墨缚 — 垂直切片" },
    { "key": "ui.phase.narrative", "value": "剧情" },
    { "key": "ui.phase.map", "value": "路线地图" },
    { "key": "ui.map.prompt", "value": "选择下一个节点" },
    { "key": "ui.phase.upgrade", "value": "升级" },
    { "key": "ui.upgrade.prompt", "value": "选择一张牌进行升级" },
    { "key": "ui.phase.shop", "value": "商店" },
    { "key": "ui.shop.prompt", "value": "金币 {0} — 购买卡牌或从牌组移除一张牌" },
    { "key": "ui.shop.buy", "value": "花费 {0} 购买：{1}" },
    { "key": "ui.shop.remove", "value": "花费 {0} 移除：{1}" },
    { "key": "ui.shop.leave", "value": "离开商店" },
    { "key": "ui.phase.combat", "value": "战斗" },
    { "key": "ui.phase.reward", "value": "选择奖励" },
    { "key": "ui.phase.completed", "value": "本局完成" },
    { "key": "ui.phase.defeat", "value": "战败" },
    { "key": "ui.combat.player_status", "value": "生命 {0}/{1}   格挡 {2}   能量 {3}   回合 {4}   状态：{5}   遗物：{6}" },
    { "key": "ui.combat.enemy_status", "value": "{0} — 生命 {1}/{2}   格挡 {3}   意图：{4}   状态：{5}" },
    { "key": "ui.intent.attack", "value": "攻击 {0}" },
    { "key": "ui.intent.block", "value": "获得 {0} 点格挡" },
    { "key": "ui.intent.status_player", "value": "对你施加 {0} {1}" },
    { "key": "ui.intent.status_self", "value": "获得 {0} {1}" },
    { "key": "ui.combat.end_turn", "value": "结束回合" },
    { "key": "ui.reward.prompt", "value": "选择一张牌加入牌组" },
    { "key": "ui.action.restart", "value": "重新开始" },
    { "key": "ui.action.switch_locale", "value": "English" },
    { "key": "ui.error.content", "value": "内容加载失败" }
  ]
}
