{
  "schemaVersion": 1,
  "localizationVersion": "vertical-slice.7",
  "locale": "en",
  "status": "approved",
  "owner": "localization",
  "source": "original",
  "entries": [
    { "key": "loc.card.strike.name", "value": "Strike" },
    { "key": "loc.card.strike.description", "value": "Deal 8 damage." },
    { "key": "loc.card.defend.name", "value": "Defend" },
    { "key": "loc.card.defend.description", "value": "Gain 6 block." },
    { "key": "loc.card.insight.name", "value": "Insight" },
    { "key": "loc.card.insight.description", "value": "Draw 1 card. Exhaust." },
    { "key": "loc.card.heavy_strike.name", "value": "Heavy Strike" },
    { "key": "loc.card.heavy_strike.description", "value": "Deal 14 damage." },
    { "key": "loc.card.quick_guard.name", "value": "Quick Guard" },
    { "key": "loc.card.quick_guard.description", "value": "Gain 4 block. Draw 1 card." },
    { "key": "loc.card.strike_plus.name", "value": "Strike+" },
    { "key": "loc.card.strike_plus.description", "value": "Deal 11 damage." },
    { "key": "loc.card.defend_plus.name", "value": "Defend+" },
    { "key": "loc.card.defend_plus.description", "value": "Gain 9 block." },
    { "key": "loc.card.insight_plus.name", "value": "Insight+" },
    { "key": "loc.card.insight_plus.description", "value": "Draw 2 cards. Exhaust." },
    { "key": "loc.card.expose.name", "value": "Expose" },
    { "key": "loc.card.expose.description", "value": "Deal 4 damage. Apply 2 Vulnerable." },
    { "key": "loc.card.focus.name", "value": "Focus" },
    { "key": "loc.card.focus.description", "value": "Gain 4 block and 1 Strength." },
    { "key": "loc.card.dampen.name", "value": "Dampen" },
    { "key": "loc.card.dampen.description", "value": "Apply 2 Weak." },
    { "key": "loc.status.strength.name", "value": "Strength" },
    { "key": "loc.status.strength.description", "value": "Deal 1 additional damage per stack." },
    { "key": "loc.status.weak.name", "value": "Weak" },
    { "key": "loc.status.weak.description", "value": "Deal 25% less damage." },
    { "key": "loc.status.vulnerable.name", "value": "Vulnerable" },
    { "key": "loc.status.vulnerable.description", "value": "Take 50% more damage." },
    { "key": "loc.relic.ember_quill.name", "value": "Ember Quill" },
    { "key": "loc.relic.ember_quill.description", "value": "At combat start, gain 2 block and 1 Strength." },
    { "key": "loc.shop.ink_market.name", "value": "Ink Market" },
    { "key": "loc.shop.ink_market.description", "value": "Trade gold for a card or remove one card from your deck." },
    { "key": "loc.enemy.ink_wisp.name", "value": "Ink Wisp" },
    { "key": "loc.enemy.ink_wisp.description", "value": "A thought given a hungry shape." },
    { "key": "loc.enemy.bronze_sentry.name", "value": "Bronze Sentry" },
    { "key": "loc.enemy.bronze_sentry.description", "value": "A tireless machine guarding the lower archive." },
    { "key": "loc.enemy.archive_warden.name", "value": "Archive Warden" },
    { "key": "loc.enemy.archive_warden.description", "value": "A relentless keeper that erases every forbidden ending." },
    { "key": "loc.encounter.first_wisp.name", "value": "First Wisp" },
    { "key": "loc.encounter.first_wisp.description", "value": "Face the wisp at the crossroads." },
    { "key": "loc.encounter.bronze_sentry.name", "value": "Sentry Hall" },
    { "key": "loc.encounter.bronze_sentry.description", "value": "Break through a bronze guardian." },
    { "key": "loc.encounter.archive_warden.name", "value": "The Last Index" },
    { "key": "loc.encounter.archive_warden.description", "value": "Defeat the Archive Warden." },
    { "key": "loc.route.prologue.name", "value": "Crossroads" },
    { "key": "loc.route.prologue.description", "value": "Choose how this chapter begins." },
    { "key": "loc.route.wisp.name", "value": "Ink Trail" },
    { "key": "loc.route.wisp.description", "value": "A fragile but unpredictable foe." },
    { "key": "loc.route.sentry.name", "value": "Bronze Hall" },
    { "key": "loc.route.sentry.description", "value": "A tougher guardian blocks the direct road." },
    { "key": "loc.route.interlude.name", "value": "Quiet Stacks" },
    { "key": "loc.route.interlude.description", "value": "Catch your breath before the sealed archive." },
    { "key": "loc.route.rest.name", "value": "Scribe's Fire" },
    { "key": "loc.route.rest.description", "value": "Upgrade one card before the final battle." },
    { "key": "loc.route.shop.name", "value": "Ink Market" },
    { "key": "loc.route.shop.description", "value": "Spend your gold before confronting the Warden." },
    { "key": "loc.route.warden.name", "value": "Archive Warden" },
    { "key": "loc.route.warden.description", "value": "Boss — the chapter ends beyond this door." },
    { "key": "loc.speaker.guide", "value": "The Guide" },
    { "key": "loc.speaker.narrator", "value": "Narrator" },
    { "key": "loc.story.crossroads", "value": "A pale wisp blocks the road. The Guide waits for your answer." },
    { "key": "loc.story.wisp_battle", "value": "You step forward. Ink gathers into claws." },
    { "key": "loc.story.peaceful_end", "value": "You leave the wisp behind. Some stories end before the first wound." },
    { "key": "loc.story.interlude", "value": "The two roads meet beneath a locked index. The Warden is close." },
    { "key": "loc.story.warden_gate", "value": "You spend the last quiet moment preparing to open the sealed door." },
    { "key": "loc.choice.face_wisp", "value": "Face the wisp" },
    { "key": "loc.choice.walk_away", "value": "Walk away" },
    { "key": "loc.choice.enter_archive", "value": "Open the sealed archive" },
    { "key": "ui.vertical_slice.title", "value": "INKBOUND — Vertical Slice" },
    { "key": "ui.phase.narrative", "value": "Story" },
    { "key": "ui.phase.map", "value": "Route Map" },
    { "key": "ui.map.prompt", "value": "Choose the next node" },
    { "key": "ui.phase.upgrade", "value": "Upgrade" },
    { "key": "ui.upgrade.prompt", "value": "Choose one card to upgrade" },
    { "key": "ui.phase.shop", "value": "Shop" },
    { "key": "ui.shop.prompt", "value": "Gold {0} — Buy a card or remove one from your deck" },
    { "key": "ui.shop.buy", "value": "Buy for {0}: {1}" },
    { "key": "ui.shop.remove", "value": "Remove for {0}: {1}" },
    { "key": "ui.shop.leave", "value": "Leave Shop" },
    { "key": "ui.phase.combat", "value": "Combat" },
    { "key": "ui.phase.reward", "value": "Choose a Reward" },
    { "key": "ui.phase.completed", "value": "Run Complete" },
    { "key": "ui.phase.defeat", "value": "Defeat" },
    { "key": "ui.combat.player_status", "value": "HP {0}/{1}   Block {2}   Energy {3}   Turn {4}   Status: {5}   Relics: {6}" },
    { "key": "ui.combat.enemy_status", "value": "{0} — HP {1}/{2}   Block {3}   Intent: {4}   Status: {5}" },
    { "key": "ui.intent.attack", "value": "Attack {0}" },
    { "key": "ui.intent.block", "value": "Gain {0} Block" },
    { "key": "ui.intent.status_player", "value": "Apply {0} {1} to you" },
    { "key": "ui.intent.status_self", "value": "Gain {0} {1}" },
    { "key": "ui.combat.end_turn", "value": "End Turn" },
    { "key": "ui.reward.prompt", "value": "Add one card to your deck" },
    { "key": "ui.action.restart", "value": "Restart Slice" },
    { "key": "ui.action.switch_locale", "value": "中文" },
    { "key": "ui.error.content", "value": "Content could not be loaded" }
  ]
}
